[
  { "id": 1, "name": "CompTIA ITF+", "vendor": "CompTIA", "category": "core-it", "focus": "Foundations", "level": 1, "retired": false, "premium": true, "exam": "FC0-U61", "logo": "../assets/images/vendor-logos/comptia.svg" },
  { "id": 2, "name": "CompTIA A+", "vendor": "CompTIA", "category": "core-it", "focus": "Foundations", "level": 1, "retired": false, "premium": true, "exam": "220-1101/220-1102", "logo": "../assets/images/vendor-logos/comptia.svg" },
  { "id": 3, "name": "CompTIA Network+", "vendor": "CompTIA", "category": "core-it", "focus": "Foundations", "level": 1, "retired": false, "premium": true, "exam": "N10-009", "logo": "../assets/images/vendor-logos/comptia.svg" },
  { "id": 4, "name": "Cisco CCNA", "vendor": "Cisco", "category": "core-it", "focus": "Enterprise R&S", "level": 2, "retired": false, "premium": true, "exam": "200-301", "logo": "../assets/images/vendor-logos/cisco.svg" },
  { "id": 5, "name": "AWS Cloud Practitioner", "vendor": "AWS", "category": "cloud-platforms", "focus": "Public Cloud", "level": 1, "retired": false, "premium": true, "exam": "CLF-C02", "logo": "../assets/images/vendor-logos/aws.svg" },
  { "id": 6, "name": "Microsoft Azure Fundamentals", "vendor": "Microsoft", "category": "cloud-platforms", "focus": "Public Cloud", "level": 1, "retired": false, "premium": true, "exam": "AZ-900", "logo": "../assets/images/vendor-logos/azure.svg" },
  { "id": 7, "name": "Google Cloud Digital Leader", "vendor": "Google Cloud", "category": "cloud-platforms", "focus": "Public Cloud", "level": 1, "retired": false, "premium": true, "logo": "" },
  { "id": 8, "name": "Red Hat RHCSA", "vendor": "Red Hat", "category": "cloud-platforms", "focus": "Virtualization", "level": 2, "retired": false, "premium": false, "logo": "" },
  { "id": 9, "name": "SUSE Certified Administrator", "vendor": "SUSE", "category": "cloud-platforms", "focus": "Linux", "level": 1, "retired": false, "premium": false, "logo": "" },
  { "id": 10, "name": "VMware VCP-DCV", "vendor": "VMware/Omnissa", "category": "cloud-platforms", "focus": "Virtualization", "level": 2, "retired": false, "premium": true, "logo": "" },
  { "id": 11, "name": "Snowflake SnowPro Core", "vendor": "Snowflake", "category": "cloud-platforms", "focus": "Data Platforms", "level": 2, "retired": false, "premium": false, "logo": "" },
  { "id": 12, "name": "MongoDB Associate Developer", "vendor": "MongoDB", "category": "software-devops", "focus": "Databases", "level": 1, "retired": false, "premium": false, "logo": "" },
  { "id": 13, "name": "NetApp Certified Data Administrator", "vendor": "NetApp", "category": "specialized-tech", "focus": "Storage & Data Protection", "level": 2, "retired": false, "premium": false, "logo": "" },
  { "id": 14, "name": "Oracle Cloud Infrastructure Foundations", "vendor": "Oracle", "category": "cloud-platforms", "focus": "Public Cloud", "level": 1, "retired": false, "premium": false, "logo": "" },
  { "id": 15, "name": "(ISC)² CC – Certified in Cybersecurity", "vendor": "(ISC)²", "category": "cybersecurity", "focus": "Blue Team", "level": 1, "retired": false, "premium": true, "logo": "" },
  { "id": 16, "name": "ISACA CISM", "vendor": "ISACA", "category": "cybersecurity", "focus": "GRC & Audit", "level": 3, "retired": false, "premium": true, "logo": "" },
  { "id": 17, "name": "EC-Council CEH", "vendor": "EC-Council", "category": "cybersecurity", "focus": "Offensive Security", "level": 3, "retired": false, "premium": false, "logo": "" },
  { "id": 18, "name": "GIAC GSEC", "vendor": "GIAC", "category": "cybersecurity", "focus": "Blue Team", "level": 2, "retired": false, "premium": false, "logo": "" },
  { "id": 19, "name": "IAPP CIPP/E", "vendor": "IAPP", "category": "cybersecurity", "focus": "Privacy", "level": 3, "retired": false, "premium": false, "logo": "" },
  { "id": 20, "name": "CSA CCSK", "vendor": "CSA", "category": "cybersecurity", "focus": "Cloud Security", "level": 2, "retired": false, "premium": false, "logo": "" },
  { "id": 21, "name": "PeopleCert ITIL 4 Foundation", "vendor": "PeopleCert", "category": "governance-agile", "focus": "Service Management", "level": 1, "retired": false, "premium": true, "logo": "" },
  { "id": 22, "name": "PMI CAPM", "vendor": "PMI", "category": "governance-agile", "focus": "Project/Program/Portfolio", "level": 1, "retired": false, "premium": true, "logo": "" },
  { "id": 23, "name": "Scrum Alliance CSM", "vendor": "Scrum Alliance", "category": "governance-agile", "focus": "Agile Frameworks", "level": 1, "retired": false, "premium": false, "logo": "" },
  { "id": 24, "name": "Veeam Veeam Certified Engineer", "vendor": "Veeam", "category": "specialized-tech", "focus": "Storage & Data Protection", "level": 2, "retired": false, "premium": false, "logo": "" },
  { "id": 25, "name": "Splunk Core Certified Power User", "vendor": "Splunk", "category": "specialized-tech", "focus": "Observability & SIEM", "level": 1, "retired": false, "premium": false, "logo": "" },
  { "id": 26, "name": "Citrix DaaS Associate", "vendor": "Citrix", "category": "specialized-tech", "focus": "Virtualization & EUC", "level": 2, "retired": false, "premium": false, "logo": "" },
  { "id": 27, "name": "Teradata Vantage Associate", "vendor": "Teradata", "category": "specialized-tech", "focus": "Data Platforms", "level": 2, "retired": false, "premium": false, "logo": "" },
  { "id": 28, "name": "ForgeRock Identity Associate", "vendor": "ForgeRock", "category": "specialized-tech", "focus": "Identity", "level": 2, "retired": false, "premium": false, "logo": "" },
  { "id": 29, "name": "ETA International CET", "vendor": "ETA International", "category": "specialized-tech", "focus": "Electronics", "level": 1, "retired": false, "premium": false, "logo": "" },
  { "id": 30, "name": "Linux Foundation CKAD", "vendor": "Linux Foundation", "category": "software-devops", "focus": "Kubernetes", "level": 2, "retired": false, "premium": false, "logo": "" },
  { "id": 31, "name": "Unity Certified Associate", "vendor": "Unity", "category": "emerging-tech", "focus": "AR/VR & Metaverse", "level": 1, "retired": false, "premium": false, "logo": "" },
  { "id": 32, "name": "NVIDIA Deep Learning", "vendor": "NVIDIA", "category": "emerging-tech", "focus": "AI & ML", "level": 2, "retired": false, "premium": false, "logo": "" },
  { "id": 33, "name": "Zend PHP Engineer", "vendor": "Zend", "category": "software-devops", "focus": "Programming", "level": 2, "retired": false, "premium": false, "logo": "" },
  { "id": 34, "name": "Qt Certified Specialist", "vendor": "Qt", "category": "software-devops", "focus": "Application Platforms", "level": 2, "retired": false, "premium": false, "logo": "" },
  { "id": 35, "name": "CNCF Kubernetes and Cloud Native Associate", "vendor": "CNCF", "category": "software-devops", "focus": "Kubernetes", "level": 1, "retired": false, "premium": false, "logo": "" },
  { "id": 36, "name": "Juniper JNCIA-Junos", "vendor": "Juniper", "category": "core-it", "focus": "Enterprise R&S", "level": 1, "retired": false, "premium": false, "logo": "" },
  { "id": 37, "name": "Aruba ACMA", "vendor": "Aruba", "category": "core-it", "focus": "Wireless", "level": 1, "retired": false, "premium": false, "logo": "" },
  { "id": 38, "name": "Nokia Network Routing Specialist", "vendor": "Nokia", "category": "core-it", "focus": "5G/SP", "level": 2, "retired": false, "premium": false, "logo": "" },
  { "id": 39, "name": "Huawei HCIA-Routing & Switching", "vendor": "Huawei", "category": "core-it", "focus": "Enterprise R&S", "level": 1, "retired": false, "premium": false, "logo": "" },
  { "id": 40, "name": "ZTE Certified Engineer", "vendor": "ZTE", "category": "core-it", "focus": "5G/SP", "level": 2, "retired": false, "premium": false, "logo": "" },
  { "id": 41, "name": "Fortinet NSE 4", "vendor": "Fortinet", "category": "cybersecurity", "focus": "Blue Team", "level": 2, "retired": false, "premium": false, "logo": "" }
]
